Quary,Answer
徐州市的名为星级上云的项目,政策包括：《市政府关于加快发展工业互联网推进企业上云的实施意见》。
徐州市的名为智能工厂、智能车间的项目,政策包括：2021年度市级技术改造专项资金申报指南。
徐州市的名为两化（深度）融合类示范试点的项目,政策包括：《关于组织开展2022年江苏省两化融合管理体系贯标示范企业培育遴选工作的通知》发布时间。
徐州市的名为工业互联网示范试点类企业（工业互联网重点平台、工业互联网标杆工厂、工业互联网典型应用企业、工业互联网专业服务商等）的项目,政策包括：《关于组织开展2022年徐州市企业技术中心认定工作的通知》。
徐州市的名为专精特新“小巨人”的项目,政策包括：《徐州市“专精特新”中小企业培育攻坚三年行动方案（2022-2024年）》。
徐州市的名为专精特新软件企业入库的项目,政策包括：关于开展2022年江苏省规划布局内重点软件企业和专精特新软件企业培育入库工作的通知。
徐州市的名为星级上云的项目,政策包括：关于组织开展2022年度第二批星级上云企业创建申报工作的通知。
徐州市的名为5G全连接工厂的项目,政策包括：关于转发省工信厅《关于加快推进5G全连接工厂建设的通知》的通知。
徐州市的名为徐州市中小企业公共服务示范平台认定的项目,政策包括：关于开展2023年度徐州市中小企业公共服务示范平台认定的通知。
